[
  {
    "id": "b3a-001",
    "name": "Surskit",
    "set_code": "b3a",
    "set_name": "Paradox Drive",
    "pack": "Paradox Drive",
    "release_date": "2026-05-28",
    "rarity": "◊",
    "pack_points": 35,
    "artist": "Yoriyuki Ikegami",
    "flavour_text": "It secretes a thick, sweet-scented syrup from the tip of its head. It lives on weed-choked ponds.",
    "alternate_versions": [],
    "image": "https://raw.githubusercontent.com/PocketDecks/pokemon-tcg-pocket-cards/refs/heads/main/images/webp/cards/b3a/001.webp",
    "image_png": "https://raw.githubusercontent.com/PocketDecks/pokemon-tcg-pocket-cards/refs/heads/main/images/png/cards/b3a/001.png",
    "ex": false,
    "mega": false,
    "shiny": false,
    "tradable": true,
    "sharable": true,
    "trade_cost": 0
  },
  {
    "id": "b3a-002",
    "name": "Masquerain",
    "set_code": "b3a",
    "set_name": "Paradox Drive",
    "pack": "Paradox Drive",
    "release_date": "2026-05-28",
    "rarity": "◊",
    "pack_points": 35,
    "artist": "kantaro",
    "flavour_text": "The antennae have distinctive patterns that look like eyes. When it rains, they grow heavy, making flight impossible.",
    "alternate_versions": [],
    "image": "https://raw.githubusercontent.com/PocketDecks/pokemon-tcg-pocket-cards/refs/heads/main/images/webp/cards/b3a/002.webp",
    "image_png": "https://raw.githubusercontent.com/PocketDecks/pokemon-tcg-pocket-cards/refs/heads/main/images/png/cards/b3a/002.png",
    "ex": false,
    "mega": false,
    "shiny": false,
    "tradable": true,
    "sharable": true,
    "trade_cost": 0
  },
  {
    "id": "b3a-003",
    "name": "Brute Bonnet",
    "set_code": "b3a",
    "set_name": "Paradox Drive",
    "pack": "Paradox Drive",
    "release_date": "2026-05-28",
    "rarity": "◊",
    "pack_points": 35,
    "artist": "Anesaki Dynamic",
    "flavour_text": "It bears a slight resemblance to a Pokémon described in a dubious magazine as a cross between a dinosaur and a mushroom.",
    "alternate_versions": [],
    "image": "https://raw.githubusercontent.com/PocketDecks/pokemon-tcg-pocket-cards/refs/heads/main/images/webp/cards/b3a/003.webp",
    "image_png": "https://raw.githubusercontent.com/PocketDecks/pokemon-tcg-pocket-cards/refs/heads/main/images/png/cards/b3a/003.png",
    "ex": false,
    "mega": false,
    "shiny": false,
    "special_tags": [
      "ancient"
    ],
    "tradable": true,
    "sharable": true,
    "trade_cost": 0
  },
  {
    "id": "b3a-004",
    "name": "Slither Wing",
    "set_code": "b3a",
    "set_name": "Paradox Drive",
    "pack": "Paradox Drive",
    "release_date": "2026-05-28",
    "rarity": "◊◊",
    "pack_points": 70,
    "artist": "Anesaki Dynamic",
    "flavour_text": "This Pokémon somewhat resembles an ancient form of Volcarona that was introduced in a dubious magazine.",
    "alternate_versions": [],
    "image": "https://raw.githubusercontent.com/PocketDecks/pokemon-tcg-pocket-cards/refs/heads/main/images/webp/cards/b3a/004.webp",
    "image_png": "https://raw.githubusercontent.com/PocketDecks/pokemon-tcg-pocket-cards/refs/heads/main/images/png/cards/b3a/004.png",
    "ex": false,
    "mega": false,
    "shiny": false,
    "special_tags": [
      "ancient"
    ],
    "tradable": true,
    "sharable": true,
    "trade_cost": 0
  },
  {
    "id": "b3a-005",
    "name": "Iron Moth",
    "set_code": "b3a",
    "set_name": "Paradox Drive",
    "pack": "Paradox Drive",
    "release_date": "2026-05-28",
    "rarity": "◊◊",
    "pack_points": 70,
    "artist": "Kouki Saitou",
    "flavour_text": "No records exist of this species being caught. Data is lacking, but the Pokémon’s traits match up with an object described in an old book.",
    "alternate_versions": [],
    "image": "https://raw.githubusercontent.com/PocketDecks/pokemon-tcg-pocket-cards/refs/heads/main/images/webp/cards/b3a/005.webp",
    "image_png": "https://raw.githubusercontent.com/PocketDecks/pokemon-tcg-pocket-cards/refs/heads/main/images/png/cards/b3a/005.png",
    "ex": false,
    "mega": false,
    "shiny": false,
    "special_tags": [
      "future"
    ],
    "tradable": true,
    "sharable": true,
    "trade_cost": 0
  },
  {
    "id": "b3a-006",
    "name": "Psyduck",
    "set_code": "b3a",
    "set_name": "Paradox Drive",
    "pack": "Paradox Drive",
    "release_date": "2026-05-28",
    "rarity": "◊",
    "pack_points": 35,
    "artist": "Kouki Saitou",
    "flavour_text": "If its chronic headache peaks, it may exhibit odd powers. It seems unable to recall such an episode.",
    "alternate_versions": [],
    "image": "https://raw.githubusercontent.com/PocketDecks/pokemon-tcg-pocket-cards/refs/heads/main/images/webp/cards/b3a/006.webp",
    "image_png": "https://raw.githubusercontent.com/PocketDecks/pokemon-tcg-pocket-cards/refs/heads/main/images/png/cards/b3a/006.png",
    "ex": false,
    "mega": false,
    "shiny": false,
    "tradable": true,
    "sharable": true,
    "trade_cost": 0
  },
  {
    "id": "b3a-007",
    "name": "Golduck",
    "set_code": "b3a",
    "set_name": "Paradox Drive",
    "pack": "Paradox Drive",
    "release_date": "2026-05-28",
    "rarity": "◊",
    "pack_points": 35,
    "artist": "Taira Akitsu",
    "flavour_text": "It swims gracefully along on the quiet, slow- moving rivers and lakes of which it is so fond.",
    "alternate_versions": [],
    "image": "https://raw.githubusercontent.com/PocketDecks/pokemon-tcg-pocket-cards/refs/heads/main/images/webp/cards/b3a/007.webp",
    "image_png": "https://raw.githubusercontent.com/PocketDecks/pokemon-tcg-pocket-cards/refs/heads/main/images/png/cards/b3a/007.png",
    "ex": false,
    "mega": false,
    "shiny": false,
    "tradable": true,
    "sharable": true,
    "trade_cost": 0
  },
  {
    "id": "b3a-008",
    "name": "Vaporeon",
    "set_code": "b3a",
    "set_name": "Paradox Drive",
    "pack": "Paradox Drive",
    "release_date": "2026-05-28",
    "rarity": "◊◊",
    "pack_points": 70,
    "artist": "kirisAki",
    "flavour_text": "Its cell composition is similar to water molecules. As a result, it can’t be seen when it melts away into water.",
    "alternate_versions": [
      {
        "set_code": "pb",
        "set_name": "Promo-B",
        "id": 65,
        "rarity": "Promo"
      }
    ],
    "image": "https://raw.githubusercontent.com/PocketDecks/pokemon-tcg-pocket-cards/refs/heads/main/images/webp/cards/b3a/008.webp",
    "image_png": "https://raw.githubusercontent.com/PocketDecks/pokemon-tcg-pocket-cards/refs/heads/main/images/png/cards/b3a/008.png",
    "ex": false,
    "mega": false,
    "shiny": false,
    "tradable": true,
    "sharable": true,
    "trade_cost": 0
  },
  {
    "id": "b3a-009",
    "name": "Buizel",
    "set_code": "b3a",
    "set_name": "Paradox Drive",
    "pack": "Paradox Drive",
    "release_date": "2026-05-28",
    "rarity": "◊",
    "pack_points": 35,
    "artist": "Sekio",
    "flavour_text": "It inflates its flotation sac, keeping its face above water in order to watch for prey movement.",
    "alternate_versions": [],
    "image": "https://raw.githubusercontent.com/PocketDecks/pokemon-tcg-pocket-cards/refs/heads/main/images/webp/cards/b3a/009.webp",
    "image_png": "https://raw.githubusercontent.com/PocketDecks/pokemon-tcg-pocket-cards/refs/heads/main/images/png/cards/b3a/009.png",
    "ex": false,
    "mega": false,
    "shiny": false,
    "tradable": true,
    "sharable": true,
    "trade_cost": 0
  },
  {
    "id": "b3a-010",
    "name": "Floatzel",
    "set_code": "b3a",
    "set_name": "Paradox Drive",
    "pack": "Paradox Drive",
    "release_date": "2026-05-28",
    "rarity": "◊",
    "pack_points": 35,
    "artist": "kodama",
    "flavour_text": "It is a common sight around fishing ports. It is known to rescue people and help fishers carry what they caught.",
    "alternate_versions": [],
    "image": "https://raw.githubusercontent.com/PocketDecks/pokemon-tcg-pocket-cards/refs/heads/main/images/webp/cards/b3a/010.webp",
    "image_png": "https://raw.githubusercontent.com/PocketDecks/pokemon-tcg-pocket-cards/refs/heads/main/images/png/cards/b3a/010.png",
    "ex": false,
    "mega": false,
    "shiny": false,
    "tradable": true,
    "sharable": true,
    "trade_cost": 0
  },
  {
    "id": "b3a-011",
    "name": "Snom",
    "set_code": "b3a",
    "set_name": "Paradox Drive",
    "pack": "Paradox Drive",
    "release_date": "2026-05-28",
    "rarity": "◊",
    "pack_points": 35,
    "artist": "Mina Nakai",
    "flavour_text": "Within its internal organs, Snom amplifies the frigid air it gets from eating snow and then uses this amplified air to create icicle-like spikes.",
    "alternate_versions": [
      {
        "set_code": "b3a",
        "set_name": "Paradox Drive",
        "id": 75,
        "rarity": "☆"
      }
    ],
    "image": "https://raw.githubusercontent.com/PocketDecks/pokemon-tcg-pocket-cards/refs/heads/main/images/webp/cards/b3a/011.webp",
    "image_png": "https://raw.githubusercontent.com/PocketDecks/pokemon-tcg-pocket-cards/refs/heads/main/images/png/cards/b3a/011.png",
    "ex": false,
    "mega": false,
    "shiny": false,
    "tradable": true,
    "sharable": true,
    "trade_cost": 0
  },
  {
    "id": "b3a-012",
    "name": "Frosmoth",
    "set_code": "b3a",
    "set_name": "Paradox Drive",
    "pack": "Paradox Drive",
    "release_date": "2026-05-28",
    "rarity": "◊",
    "pack_points": 35,
    "artist": "Kagemaru Himeno",
    "flavour_text": "It causes blizzards as it flies around with its huge, chill-emanating wings. Clean meltwater is its favorite thing to drink.",
    "alternate_versions": [],
    "image": "https://raw.githubusercontent.com/PocketDecks/pokemon-tcg-pocket-cards/refs/heads/main/images/webp/cards/b3a/012.webp",
    "image_png": "https://raw.githubusercontent.com/PocketDecks/pokemon-tcg-pocket-cards/refs/heads/main/images/png/cards/b3a/012.png",
    "ex": false,
    "mega": false,
    "shiny": false,
    "tradable": true,
    "sharable": true,
    "trade_cost": 0